[{
  "_id": {
    "$oid": "67f64dff70649dd5ec357d30"
  },
  "name": {
    "first": "אניס",
    "last": "מחאמיד",
    "_id": {
      "$oid": "67f64dff70649dd5ec357d31"
    }
  },
  "phone": {
    "phone_1": "0538346915",
    "phone_2": "",
    "_id": {
      "$oid": "682a7b0d29409da1efe77573"
    }
  },
  "address": {
    "city": "אום אל-פחם ",
    "street": "עין אל ד'רווה ",
    "houseNumber": "24 א",
    "_id": {
      "$oid": "682a7b0d29409da1efe77574"
    }
  },
  "email": "anes@g.com",
  "password": "$2b$10$ng0Z1X4d8GOGU2VQohKboO8HmAOsSXeaYbfzlbmvjCccaM6Svlu62",
  "image": {
    "url": "https://images.unsplash.com/photo-1744179211676-f0536705fcd3?w=500&auto=format&fit=crop&q=60&ixlib=rb-4.0.3&ixid=M3wxMjA3fDB8MHxmZWF0dXJlZC1waG90b3MtZmVlZHw3Nnx8fGVufDB8fHx8fA%3D%3D",
    "alt": "anes",
    "_id": {
      "$oid": "67f64dff70649dd5ec357d34"
    }
  },
  "role": "Admin",
  "activity": [
    "2025-04-09T10:38:05.119Z",
    "2025-04-09T10:38:38.792Z",
    "2025-04-09T12:34:18.093Z",
    "2025-04-09T18:56:49.892Z",
    "2025-04-09T19:22:36.651Z",
    "2025-04-09T19:30:55.097Z",
    "2025-04-09T22:05:18.320Z",
    "2025-04-09T22:29:42.401Z",
    "2025-04-10T00:34:17.156Z",
    "2025-04-10T11:54:18.651Z",
    "2025-04-10T12:00:28.246Z",
    "2025-04-10T19:12:00.547Z",
    "2025-04-10T19:28:45.889Z",
    "2025-04-10T22:04:48.998Z",
    "2025-04-11T00:21:18.565Z",
    "2025-04-11T10:49:18.796Z",
    "2025-04-11T10:52:13.396Z",
    "2025-04-14T09:12:13.079Z",
    "4/20/2025, 10:59:50 PM",
    "4/20/2025, 10:19:27 PM",
    "4/21/2025, 12:07:30 AM",
    "4/21/2025, 12:25:49 AM",
    "4/21/2025, 12:25:50 AM",
    "4/21/2025, 12:38:15 AM",
    "4/21/2025, 12:38:16 AM",
    "4/21/2025, 12:44:00 AM",
    "4/21/2025, 9:17:12 AM",
    "4/21/2025, 2:11:27 PM",
    "4/22/2025, 2:00:54 PM",
    "4/22/2025, 5:57:53 PM",
    "4/23/2025, 10:31:52 AM",
    "4/23/2025, 11:59:03 AM",
    "4/23/2025, 11:59:24 AM",
    "4/23/2025, 10:05:40 PM",
    "4/23/2025, 10:05:41 PM",
    "4/25/2025, 2:20:06 AM",
    "4/25/2025, 9:30:25 AM",
    "4/25/2025, 11:21:03 AM",
    "4/25/2025, 1:46:42 PM",
    "4/25/2025, 1:46:43 PM",
    "4/26/2025, 3:59:06 PM",
    "4/26/2025, 4:11:40 PM",
    "4/27/2025, 8:34:39 AM",
    "4/27/2025, 9:25:50 AM",
    "4/27/2025, 9:33:08 AM",
    "4/27/2025, 10:29:33 AM",
    "4/27/2025, 12:08:36 PM",
    "4/27/2025, 2:32:15 PM",
    "4/27/2025, 9:24:23 PM",
    "4/27/2025, 9:24:24 PM",
    "4/28/2025, 11:29:26 PM",
    "4/28/2025, 11:29:37 PM",
    "4/29/2025, 4:10:26 PM",
    "4/29/2025, 4:52:01 PM",
    "4/29/2025, 6:19:56 PM",
    "4/30/2025, 12:22:27 AM",
    "4/30/2025, 12:22:09 PM",
    "5/1/2025, 3:17:56 PM",
    "5/1/2025, 9:32:18 PM",
    "5/2/2025, 2:13:03 PM",
    "5/3/2025, 8:01:53 PM",
    "5/3/2025, 8:01:54 PM",
    "5/3/2025, 8:02:16 PM",
    "5/3/2025, 8:02:25 PM",
    "5/3/2025, 8:02:37 PM",
    "5/4/2025, 6:01:46 PM",
    "5/4/2025, 6:01:47 PM",
    "5/5/2025, 11:46:11 AM",
    "5/5/2025, 1:59:03 PM",
    "5/5/2025, 2:26:43 PM",
    "5/5/2025, 9:58:08 PM",
    "5/5/2025, 10:21:54 PM",
    "5/5/2025, 10:45:27 PM",
    "5/6/2025, 10:37:51 AM",
    "5/6/2025, 1:08:48 PM",
    "5/6/2025, 5:13:26 PM",
    "5/6/2025, 5:58:46 PM",
    "5/6/2025, 6:51:34 PM",
    "5/6/2025, 6:54:00 PM",
    "5/6/2025, 6:56:00 PM",
    "5/7/2025, 12:01:24 PM",
    "5/7/2025, 8:13:27 PM",
    "5/8/2025, 1:27:09 PM",
    "5/8/2025, 1:30:26 PM",
    "5/8/2025, 3:51:25 PM",
    "5/9/2025, 3:36:27 PM",
    "5/10/2025, 9:22:15 AM",
    "5/10/2025, 9:33:28 AM",
    "5/10/2025, 9:33:54 AM",
    "5/10/2025, 10:45:15 AM",
    "5/10/2025, 10:45:24 AM",
    "5/11/2025, 1:22:34 AM",
    "5/11/2025, 9:36:35 AM",
    "5/11/2025, 10:12:22 AM",
    "5/11/2025, 10:17:13 AM",
    "5/11/2025, 10:25:33 AM",
    "5/11/2025, 1:11:30 PM",
    "5/11/2025, 1:38:51 PM",
    "5/11/2025, 8:01:00 PM",
    "5/12/2025, 5:55:39 PM",
    "5/12/2025, 6:55:19 PM",
    "5/12/2025, 8:25:00 PM",
    "5/12/2025, 9:05:17 PM",
    "5/12/2025, 9:05:25 PM",
    "5/13/2025, 12:52:21 AM",
    "5/13/2025, 1:37:14 AM",
    "5/13/2025, 1:48:32 AM",
    "5/13/2025, 10:52:49 AM",
    "5/13/2025, 6:55:15 PM",
    "5/15/2025, 1:01:24 AM",
    "5/15/2025, 1:31:40 AM",
    "5/15/2025, 6:39:54 PM",
    "5/15/2025, 10:22:27 PM",
    "5/17/2025, 12:23:21 PM",
    "5/17/2025, 2:25:44 PM",
    "5/18/2025, 5:50:04 PM",
    "5/18/2025, 7:46:48 PM",
    "5/19/2025, 12:15:08 AM",
    "5/19/2025, 12:16:12 AM",
    "5/19/2025, 11:50:14 AM",
    "5/19/2025, 12:52:15 PM",
    "5/19/2025, 11:19:28 PM",
    "5/19/2025, 11:23:40 PM",
    "5/20/2025, 1:58:48 AM",
    "5/20/2025, 8:36:43 AM",
    "5/20/2025, 8:45:28 AM",
    "5/20/2025, 2:10:27 PM",
    "5/20/2025, 8:15:49 PM",
    "5/21/2025, 10:41:32 AM",
    "5/21/2025, 10:43:00 AM",
    "5/21/2025, 11:20:11 AM",
    "5/22/2025, 11:10:22 PM",
    "5/23/2025, 12:01:38 AM",
    "5/23/2025, 9:01:06 AM",
    "5/23/2025, 3:39:53 PM",
    "5/24/2025, 11:29:15 AM",
    "5/24/2025, 1:57:41 PM",
    "5/24/2025, 2:03:38 PM",
    "5/24/2025, 3:14:51 PM",
    "5/24/2025, 4:18:11 PM",
    "5/24/2025, 11:18:03 PM",
    "5/25/2025, 11:11:37 AM"
  ],
  "registrAt": "1,744,195,071,864",
  "createdAt": {
    "$date": "2025-04-09T10:37:51.885Z"
  },
  "updatedAt": {
    "$date": "2025-05-25T11:11:37.619Z"
  },
  "__v": 142,
  "status": true
},
{
  "_id": {
    "$oid": "67f67e6d4c58c7ef178a7269"
  },
  "name": {
    "first": "אניס",
    "last": "מחאמיד",
    "_id": {
      "$oid": "67f64dff70649dd5ec357d31"
    }
  },
  "phone": {
    "phone_1": "0538346915",
    "phone_2": "",
    "_id": {
      "$oid": "67f64dff70649dd5ec357d32"
    }
  },
  "address": {
    "city": "אום אל פלם",
    "street": "מחאמיד",
    "houseNumber": "24 א",
    "_id": {
      "$oid": "67f64dff70649dd5ec357d33"
    }
  },
  "email": "anes2@g.com",
  "password": "$2b$10$ng0Z1X4d8GOGU2VQohKboO8HmAOsSXeaYbfzlbmvjCccaM6Svlu62",
  "image": {
    "url": "https://images.unsplash.com/photo-1742302954292-1f903368084e?w=500&auto=format&fit=crop&q=60&ixlib=rb-4.0.3&ixid=M3wxMjA3fDB8MHxmZWF0dXJlZC1waG90b3MtZmVlZHwzfHx8ZW58MHx8fHx8",
    "alt": "anes",
    "_id": {
      "$oid": "67f64dff70649dd5ec357d34"
    }
  },
  "role": "Moderator",
  "activity": [
    "2025-04-09T10:38:05.119Z",
    "2025-04-09T10:38:38.792Z",
    "2025-04-09T12:34:18.093Z",
    "2025-04-09T14:04:42.464Z",
    "2025-04-09T14:05:16.194Z",
    "2025-04-09T19:22:55.256Z",
    "2025-04-10T01:27:30.246Z",
    "2025-04-10T19:13:15.263Z",
    "2025-04-10T20:54:55.632Z",
    "2025-04-10T22:09:57.108Z",
    "2025-04-10T23:39:16.018Z",
    "2025-04-10T23:42:14.552Z",
    "2025-04-11T00:04:54.346Z",
    "2025-04-11T00:06:00.073Z",
    "2025-04-11T00:07:37.965Z",
    "2025-04-11T00:09:56.399Z",
    "2025-04-11T00:13:35.591Z",
    "2025-04-11T00:17:12.920Z",
    "2025-04-11T00:21:38.657Z",
    "2025-04-11T00:22:14.140Z",
    "2025-04-11T10:53:13.108Z",
    "5/12/2025, 7:00:28 PM",
    "5/12/2025, 8:27:51 PM",
    "5/12/2025, 9:05:40 PM",
    "5/13/2025, 12:51:53 AM",
    "5/13/2025, 1:36:44 AM",
    "5/18/2025, 12:19:17 PM",
    "5/18/2025, 3:51:53 PM",
    "5/18/2025, 5:43:36 PM",
    "5/18/2025, 8:35:39 PM",
    "5/19/2025, 11:19:35 PM",
    "5/19/2025, 11:25:41 PM",
    "5/19/2025, 11:26:37 PM",
    "5/20/2025, 1:57:30 AM",
    "5/20/2025, 1:58:37 AM",
    "5/20/2025, 8:44:25 AM",
    "5/20/2025, 2:11:19 PM",
    "5/20/2025, 2:17:20 PM",
    "5/20/2025, 2:17:57 PM",
    "5/20/2025, 2:18:36 PM",
    "5/20/2025, 2:18:57 PM",
    "5/20/2025, 8:15:34 PM",
    "5/24/2025, 1:14:20 AM",
    "5/24/2025, 11:30:23 AM",
    "5/24/2025, 11:37:36 AM",
    "5/24/2025, 2:00:23 PM",
    "5/24/2025, 3:13:54 PM",
    "5/24/2025, 3:16:02 PM",
    "5/24/2025, 11:17:42 PM"
  ],
  "registrAt": "1,744,195,071,864",
  "createdAt": {
    "$date": "2025-04-09T10:37:51.885Z"
  },
  "updatedAt": {
    "$date": "2025-05-25T03:25:52.931Z"
  },
  "__v": 49,
  "status": false
},
{
  "_id": {
    "$oid": "680606610acb0026c81aabe8"
  },
  "googleId": "100611871279298572724",
  "name": {
    "first": "Sameha",
    "last": "Mhamed",
    "_id": {
      "$oid": "680606610acb0026c81aabe9"
    }
  },
  "phone": {
    "phone_1": "0549472214",
    "phone_2": "",
    "_id": {
      "$oid": "680606610acb0026c81aabea"
    }
  },
  "address": {
    "city": "אום אל פחם",
    "street": "מחאמיד",
    "houseNumber": "24 א",
    "_id": {
      "$oid": "680606610acb0026c81aabeb"
    }
  },
  "email": "samehamhamed7@gmail.com",
  "image": {
    "url": "https://lh3.googleusercontent.com/a/ACg8ocJlkdyOvR-xEX5ePstVaHrLM5hQ5lGcWUKUiVlIStTnPJKU2Q=s96-c",
    "alt": "Sameha",
    "_id": {
      "$oid": "680606610acb0026c81aabec"
    }
  },
  "role": "Client",
  "activity": [],
  "createdAt": {
    "$date": "2025-04-21T08:48:33.627Z"
  },
  "updatedAt": {
    "$date": "2025-04-21T08:48:33.627Z"
  },
  "__v": 0
},
{
  "_id": {
    "$oid": "680659b07e1a1bc0323762ac"
  },
  "googleId": "100475241299628876960",
  "name": {
    "first": "Ali",
    "last": "7amed",
    "_id": {
      "$oid": "680659b07e1a1bc0323762ad"
    }
  },
  "phone": {
    "phone_1": "0549190997",
    "phone_2": "",
    "_id": {
      "$oid": "680659b07e1a1bc0323762ae"
    }
  },
  "address": {
    "city": "Umm-alfahem",
    "street": "Aen aldrwa",
    "houseNumber": "28",
    "_id": {
      "$oid": "680659b07e1a1bc0323762af"
    }
  },
  "email": "alixd123450@gmail.com",
  "image": {
    "url": "https://lh3.googleusercontent.com/a/ACg8ocKchyBuA132FnfG3mAKabkUkTHuT6LBDiv68KAlslhVoAFg4oGv=s96-c",
    "alt": "Ali",
    "_id": {
      "$oid": "680659b07e1a1bc0323762b0"
    }
  },
  "role": "Client",
  "activity": [],
  "createdAt": {
    "$date": "2025-04-21T14:44:00.155Z"
  },
  "updatedAt": {
    "$date": "2025-04-21T14:44:00.155Z"
  },
  "__v": 0
},
{
  "_id": {
    "$oid": "680798cd799e9e1d8816ab69"
  },
  "googleId": "108156044493177529142",
  "name": {
    "first": "fefooo",
    "last": "fefooo",
    "_id": {
      "$oid": "680798cd799e9e1d8816ab6a"
    }
  },
  "phone": {
    "phone_1": "0539730079",
    "phone_2": "0539730079",
    "_id": {
      "$oid": "68330c6135c8e76ddcc8c943"
    }
  },
  "address": {
    "city": "אום אל-פחם ",
    "street": "אבו בכר ",
    "houseNumber": "19",
    "_id": {
      "$oid": "68330c6135c8e76ddcc8c945"
    }
  },
  "email": "mhameedfefooo@gmail.com",
  "image": {
    "url": "https://lh3.googleusercontent.com/a/ACg8ocLQUoZfPw8ZownfumBgbMJ79WrbrQEM3FGzZn3zCfWWSYUYbw=s96-c",
    "_id": {
      "$oid": "68330c6135c8e76ddcc8c944"
    }
  },
  "role": "Client",
  "activity": [],
  "createdAt": {
    "$date": "2025-04-22T13:25:33.953Z"
  },
  "updatedAt": {
    "$date": "2025-05-25T12:26:09.093Z"
  },
  "__v": 0
},
{
  "_id": {
    "$oid": "681114db2c4886905e8b26e3"
  },
  "name": {
    "first": "anes",
    "last": "mhamid",
    "_id": {
      "$oid": "681114db2c4886905e8b26e4"
    }
  },
  "phone": {
    "phone_1": "0538346915",
    "phone_2": "",
    "_id": {
      "$oid": "681114db2c4886905e8b26e5"
    }
  },
  "address": {
    "city": "רהט",
    "street": "dff",
    "houseNumber": "dsfdsf",
    "_id": {
      "$oid": "681114db2c4886905e8b26e6"
    }
  },
  "email": "anes@gg.com",
  "password": "$2b$10$8EFPN0z9gKBsZJktSrgh2uKV.9HGfGnKZ/RgUD8QB1U7jCEuCRmlm",
  "gender": "זכר",
  "image": {
    "url": "",
    "alt": "",
    "_id": {
      "$oid": "681114db2c4886905e8b26e7"
    }
  },
  "role": "Client",
  "activity": [
    "4/29/2025, 6:05:22 PM",
    "4/29/2025, 6:11:42 PM",
    "5/1/2025, 9:32:08 PM",
    "5/2/2025, 2:15:50 PM",
    "5/2/2025, 2:16:35 PM",
    "5/4/2025, 6:49:25 PM",
    "5/4/2025, 6:53:53 PM",
    "5/4/2025, 6:53:54 PM",
    "5/4/2025, 7:11:05 PM",
    "5/5/2025, 2:27:07 PM",
    "5/5/2025, 9:19:27 PM",
    "5/5/2025, 9:32:30 PM",
    "5/5/2025, 10:20:43 PM",
    "5/5/2025, 10:27:05 PM",
    "5/6/2025, 10:38:31 AM",
    "5/6/2025, 10:38:52 AM",
    "5/6/2025, 10:59:41 AM",
    "5/6/2025, 1:14:56 PM",
    "5/7/2025, 8:17:17 PM",
    "5/11/2025, 10:12:48 AM",
    "5/11/2025, 10:13:11 AM",
    "5/11/2025, 10:13:42 AM",
    "5/11/2025, 10:17:58 AM",
    "5/11/2025, 10:21:24 AM",
    "5/20/2025, 8:45:51 AM",
    "5/20/2025, 2:10:41 PM",
    "5/20/2025, 2:19:59 PM",
    "5/20/2025, 8:16:24 PM",
    "5/20/2025, 8:16:45 PM",
    "5/20/2025, 8:17:12 PM"
  ],
  "registrAt": "29.4.2025, 18:05:15",
  "terms": "true",
  "createdAt": {
    "$date": "2025-04-29T18:05:15.166Z"
  },
  "updatedAt": {
    "$date": "2025-05-20T20:17:32.638Z"
  },
  "__v": 30,
  "status": false
},
{
  "_id": {
    "$oid": "68111bb22c4886905e8b271e"
  },
  "googleId": "107043837289661292781",
  "name": {
    "first": "Saeb",
    "last": "Masarwa",
    "_id": {
      "$oid": "68111bb22c4886905e8b271f"
    }
  },
  "phone": {
    "phone_1": "0506303608",
    "phone_2": "",
    "_id": {
      "$oid": "68111bb22c4886905e8b2720"
    }
  },
  "address": {
    "city": "טייבה",
    "street": "אלשל",
    "houseNumber": "1",
    "_id": {
      "$oid": "68111bb22c4886905e8b2721"
    }
  },
  "email": "saeb2312@gmail.com",
  "image": {
    "url": "https://lh3.googleusercontent.com/a/ACg8ocKY0dLqarzne7_Y80BeSKtxnc1aSh_LNIzrjPcFO8GMUxvEyDVFWA=s96-c",
    "alt": "Saeb",
    "_id": {
      "$oid": "68111bb22c4886905e8b2722"
    }
  },
  "role": "Client",
  "activity": [],
  "createdAt": {
    "$date": "2025-04-29T18:34:26.561Z"
  },
  "updatedAt": {
    "$date": "2025-04-29T18:34:26.561Z"
  },
  "__v": 0
},
{
  "_id": {
    "$oid": "6819f23f52d2013ec43afb20"
  },
  "googleId": "110469159675739589323",
  "name": {
    "first": "ולאא",
    "last": "מחאמיד",
    "_id": {
      "$oid": "6819f23f52d2013ec43afb21"
    }
  },
  "email": "walaamhamid1@gmail.com",
  "password": "$2b$10$qXbZjMw2ZKFnx3S.Bre.kuamm6H86zU2Oo7qh/Jkzo9O5pzScLQ5G",
  "image": {
    "url": "https://plus.unsplash.com/premium_photo-1676475964992-6404b8db0b53?q=80&w=987&auto=format&fit=crop&ixlib=rb-4.1.0&ixid=M3wxMjA3fDB8MHxwaG90by1wYWdlfHx8fGVufDB8fHx8fA%3D%3D",
    "_id": {
      "$oid": "682db15d7223cc900d67f4cd"
    }
  },
  "role": "Admin",
  "activity": [
    "5/6/2025, 11:27:59 AM"
  ],
  "registrAt": "6.5.2025, 11:27:59",
  "createdAt": {
    "$date": "2025-05-06T11:27:59.663Z"
  },
  "updatedAt": {
    "$date": "2025-05-24T19:44:11.796Z"
  },
  "__v": 0,
  "address": {
    "city": "אום אל-פחם ",
    "street": "עין אל ד'רווה ",
    "houseNumber": "24",
    "_id": {
      "$oid": "682db15d7223cc900d67f4ce"
    }
  },
  "phone": {
    "phone_1": "0525454545",
    "phone_2": "",
    "_id": {
      "$oid": "682db15d7223cc900d67f4cc"
    }
  },
  "status": true
},
{
  "_id": {
    "$oid": "681a1cff420057a44dbb3dc1"
  },
  "googleId": "106095862691502255115",
  "name": {
    "first": "Omaym 7amed",
    "last": "7amed",
    "_id": {
      "$oid": "681a1cff420057a44dbb3dc2"
    }
  },
  "email": "omaymamedamed@gmail.com",
  "password": "$2b$10$0sy30T71238I3XpGmx8NWu79eAhY0KW/y5A4YkSmBhYMc68QxoTYq",
  "image": {
    "url": "https://lh3.googleusercontent.com/a/ACg8ocLUPcOYTwxfWtOr2I5jKCsPcBQHay8ZJYQO8ckoQoEO_wPClQ=s96-c",
    "alt": "Omaym 7amed 7amed",
    "_id": {
      "$oid": "681a1cff420057a44dbb3dc3"
    }
  },
  "role": "Client",
  "activity": [
    "5/6/2025, 2:30:22 PM"
  ],
  "registrAt": "6.5.2025, 14:30:23",
  "createdAt": {
    "$date": "2025-05-06T14:30:23.116Z"
  },
  "updatedAt": {
    "$date": "2025-05-08T15:50:56.211Z"
  },
  "__v": 0,
  "address": {
    "city": "אום אל פחם",
    "street": "عينةالذروه",
    "houseNumber": "24",
    "_id": {
      "$oid": "681cd2e03d85b566cf91191d"
    }
  },
  "phone": {
    "phone_1": "0549475660",
    "phone_2": "",
    "_id": {
      "$oid": "681cd2e03d85b566cf91191c"
    }
  }
},
{
  "_id": {
    "$oid": "681a43c6b34162bbfc8e38ce"
  },
  "name": {
    "first": "Aisar",
    "last": "Mha",
    "_id": {
      "$oid": "681a43c6b34162bbfc8e38cf"
    }
  },
  "phone": {
    "phone_1": "0537611091",
    "phone_2": "05",
    "_id": {
      "$oid": "681a43c6b34162bbfc8e38d0"
    }
  },
  "address": {
    "city": "אום אל פחם",
    "street": "Omarffff",
    "houseNumber": "Gdgd",
    "_id": {
      "$oid": "681a43c6b34162bbfc8e38d1"
    }
  },
  "email": "hbebmhajna@gmail.com",
  "password": "$2b$10$rLpZopyCK1Xn6MuG5fiKOOjP6XgdrYkuvKsCamIURNsecdgLyIdPi",
  "gender": "זכר",
  "image": {
    "url": "",
    "alt": "",
    "_id": {
      "$oid": "681a43c6b34162bbfc8e38d2"
    }
  },
  "role": "Client",
  "activity": [
    "5/6/2025, 5:16:15 PM"
  ],
  "registrAt": "6.5.2025, 17:15:50",
  "terms": "true",
  "createdAt": {
    "$date": "2025-05-06T17:15:50.744Z"
  },
  "updatedAt": {
    "$date": "2025-05-06T17:16:15.854Z"
  },
  "__v": 1
},
{
  "_id": {
    "$oid": "681f1b5ec6d3fdd6887eb993"
  },
  "googleId": "109364487752025652887",
  "name": {
    "first": "Jimmy",
    "last": "khalayleh",
    "_id": {
      "$oid": "681f1b5ec6d3fdd6887eb994"
    }
  },
  "phone": {
    "phone_1": "0524315810",
    "phone_2": "",
    "_id": {
      "$oid": "681f1b5ec6d3fdd6887eb995"
    }
  },
  "address": {
    "city": "חיפה",
    "street": "Pevzner",
    "houseNumber": "17",
    "_id": {
      "$oid": "681f1b5ec6d3fdd6887eb996"
    }
  },
  "email": "khalayleh.jimmy@gmail.com",
  "password": "$2b$10$UGQ7NWZ5.Gxzpe8pVf1kJ.UH0Xyh8IHjKqbHMkF9O3n5TGhbaOdvG",
  "image": {
    "url": "https://lh3.googleusercontent.com/a/ACg8ocL0o3iDQ9Jef_y5_tWk-orv3l1Kw5L4STCR4sxXFJihW0OB2Cw=s96-c",
    "alt": "Jimmy khalayleh",
    "_id": {
      "$oid": "681f1b5ec6d3fdd6887eb997"
    }
  },
  "role": "Admin",
  "activity": [
    "10.5.2025, 9:24:46"
  ],
  "registrAt": "10.5.2025, 9:24:46",
  "createdAt": {
    "$date": "2025-05-10T09:24:46.681Z"
  },
  "updatedAt": {
    "$date": "2025-05-10T09:26:49.781Z"
  },
  "__v": 0
},
{
  "_id": {
    "$oid": "68223e920093a7b33bbaeaae"
  },
  "name": {
    "first": "מור",
    "last": "אשכנזי",
    "_id": {
      "$oid": "68223e920093a7b33bbaeaaf"
    }
  },
  "phone": {
    "phone_1": "0555255635",
    "phone_2": "",
    "_id": {
      "$oid": "68223e920093a7b33bbaeab0"
    }
  },
  "address": {
    "city": "חיפה ",
    "street": "קרית הטכניון ",
    "houseNumber": "",
    "_id": {
      "$oid": "68223e920093a7b33bbaeab1"
    }
  },
  "email": "mor@gmail.com",
  "password": "$2b$10$jnDn/fT7xAoc95W/bJbrleHwbsxNkIzz/YfI08VQru9un4./8I4s6",
  "gender": "נקבה",
  "image": {
    "url": "",
    "alt": "",
    "_id": {
      "$oid": "68223e920093a7b33bbaeab2"
    }
  },
  "role": "Client",
  "activity": [
    "5/12/2025, 6:32:01 PM"
  ],
  "registrAt": "12.5.2025, 18:31:46",
  "status": false,
  "terms": "true",
  "createdAt": {
    "$date": "2025-05-12T18:31:46.436Z"
  },
  "updatedAt": {
    "$date": "2025-05-20T08:42:52.313Z"
  },
  "__v": 1
},
{
  "_id": {
    "$oid": "682c42240184558f5aaaa417"
  },
  "googleId": "114218359985129467613",
  "name": {
    "first": "Anis",
    "last": "Mhamied",
    "_id": {
      "$oid": "682c42240184558f5aaaa418"
    }
  },
  "phone": {
    "phone_1": "0538346915",
    "phone_2": "",
    "_id": {
      "$oid": "682c42240184558f5aaaa419"
    }
  },
  "address": {
    "city": "אום אל-פחם ",
    "street": "דרך עין אל-ד'רווה ",
    "houseNumber": "24 א",
    "_id": {
      "$oid": "682c42240184558f5aaaa41a"
    }
  },
  "email": "anesmhamed1@gmail.com",
  "password": "$2b$10$8EJmIwuGiTrhu84G.Ia8sewGAjPPplflcr0PfWdrodQWm/nLo0iue",
  "image": {
    "url": "https://lh3.googleusercontent.com/a/ACg8ocI2mPb6ys7aqePyz56Xd3o7GUiD48PeIKH26OSAfIshs54PqZ1EPg=s96-c",
    "alt": "Anis Mhamied",
    "_id": {
      "$oid": "682c42240184558f5aaaa41b"
    }
  },
  "role": "Client",
  "activity": [
    "20.5.2025, 8:49:40"
  ],
  "registrAt": "20.5.2025, 8:49:40",
  "status": false,
  "createdAt": {
    "$date": "2025-05-20T08:49:40.733Z"
  },
  "updatedAt": {
    "$date": "2025-05-24T01:16:37.815Z"
  },
  "__v": 0
},
{
  "_id": {
    "$oid": "682ce468d78bd90952c43eec"
  },
  "name": {
    "first": "Khalid",
    "last": "Jas",
    "_id": {
      "$oid": "682ce468d78bd90952c43eed"
    }
  },
  "phone": {
    "phone_1": "0546576787",
    "phone_2": "",
    "_id": {
      "$oid": "682dad0384760477d2497db6"
    }
  },
  "address": {
    "city": "מצר ",
    "street": "מצר ",
    "houseNumber": "566",
    "_id": {
      "$oid": "682dad0384760477d2497db8"
    }
  },
  "email": "Khalid.2@gmail.com",
  "password": "$2b$10$IaZbUO6Npe/8ErT0/POQs.LDZkcRCIKir38.WInmK6AqbwQhSyHeG",
  "gender": "זכר",
  "image": {
    "url": "https://images.unsplash.com/photo-1746647695879-bfab32f59f34?w=500&auto=format&fit=crop&q=60&ixlib=rb-4.1.0&ixid=M3wxMjA3fDB8MHxmZWF0dXJlZC1waG90b3MtZmVlZHwyfHx8ZW58MHx8fHx8",
    "_id": {
      "$oid": "682dad0384760477d2497db7"
    }
  },
  "role": "Client",
  "activity": [
    "5/20/2025, 8:22:11 PM",
    "5/20/2025, 8:23:55 PM",
    "5/21/2025, 10:35:09 AM",
    "5/21/2025, 10:39:27 AM",
    "5/21/2025, 11:12:37 AM",
    "5/24/2025, 1:16:59 AM"
  ],
  "registrAt": "20.5.2025, 20:22:00",
  "status": false,
  "terms": "true",
  "createdAt": {
    "$date": "2025-05-20T20:22:00.047Z"
  },
  "updatedAt": {
    "$date": "2025-05-24T11:30:14.919Z"
  },
  "__v": 6
},
{
  "_id": {
    "$oid": "682db6067223cc900d67f646"
  },
  "name": {
    "first": "anes",
    "last": "anes",
    "_id": {
      "$oid": "682db6067223cc900d67f647"
    }
  },
  "phone": {
    "phone_1": "0542545458",
    "phone_2": "",
    "_id": {
      "$oid": "682db6067223cc900d67f648"
    }
  },
  "address": {
    "city": "אבו סנאן ",
    "street": "א נסים ",
    "houseNumber": "212",
    "_id": {
      "$oid": "682db6067223cc900d67f649"
    }
  },
  "email": "anes.2@gmail.com",
  "password": "$2b$10$PkZLvVxSVfNTWnqktAA5QewRogC/r169QZiPQxEbJOmM5Wby4J/Gq",
  "gender": "זכר",
  "image": {
    "url": "",
    "alt": "",
    "_id": {
      "$oid": "682db6067223cc900d67f64a"
    }
  },
  "role": "Client",
  "activity": [
    "5/21/2025, 11:16:28 AM",
    "5/24/2025, 1:13:51 AM",
    "5/24/2025, 2:00:11 PM"
  ],
  "registrAt": "21.5.2025, 11:16:22",
  "status": false,
  "terms": "true",
  "createdAt": {
    "$date": "2025-05-21T11:16:22.882Z"
  },
  "updatedAt": {
    "$date": "2025-05-24T14:00:14.488Z"
  },
  "__v": 3
},
{
  "_id": {
    "$oid": "682db6d17223cc900d67f65c"
  },
  "name": {
    "first": "Wadeq",
    "last": "Mahamed",
    "_id": {
      "$oid": "682db6d17223cc900d67f65d"
    }
  },
  "phone": {
    "phone_1": "0534435034",
    "phone_2": "",
    "_id": {
      "$oid": "682ddf483dc3ff2121007712"
    }
  },
  "address": {
    "city": "אום אל-פחם ",
    "street": "אל ארג'ואן ",
    "houseNumber": "",
    "_id": {
      "$oid": "682ddf483dc3ff2121007714"
    }
  },
  "email": "wadeeamah@gmail.com",
  "password": "$2b$10$BOQFCFwCzwyTFm0/tspMT.uhMsEwP2n/bUz2V/ozKCayUeHaukpY6",
  "gender": "זכר",
  "image": {
    "url": "",
    "_id": {
      "$oid": "682ddf483dc3ff2121007713"
    }
  },
  "role": "Client",
  "activity": [
    "5/21/2025, 11:19:52 AM"
  ],
  "registrAt": "21.5.2025, 11:19:45",
  "status": false,
  "terms": "true",
  "createdAt": {
    "$date": "2025-05-21T11:19:45.118Z"
  },
  "updatedAt": {
    "$date": "2025-05-21T14:12:24.023Z"
  },
  "__v": 1
},
{
  "_id": {
    "$oid": "682fb0e0e16d0b4ac9c05871"
  },
  "googleId": "117569234332411895638",
  "name": {
    "first": "mhmd",
    "last": "mhamid",
    "_id": {
      "$oid": "682fb0e0e16d0b4ac9c05872"
    }
  },
  "phone": {
    "phone_1": "0535521366",
    "phone_2": "",
    "_id": {
      "$oid": "682fb0e0e16d0b4ac9c05873"
    }
  },
  "address": {
    "city": "אום אל-פחם ",
    "street": "דרך עין אל-ד'רווה ",
    "houseNumber": "24",
    "_id": {
      "$oid": "682fb0e0e16d0b4ac9c05874"
    }
  },
  "email": "arqam.0532273594@gmail.com",
  "password": "$2b$10$K7es47yVKD9ZpG02pbvDVuiCkYiv5xG/bQVv.oMvmCtidldF/BWYS",
  "image": {
    "url": "https://lh3.googleusercontent.com/a/ACg8ocIIfCLvAEEyx0ibwU21TLTaKCCUfwVbaePaNFSCbzfaDmN9EQ=s96-c",
    "alt": "mhmd mhamid",
    "_id": {
      "$oid": "682fb0e0e16d0b4ac9c05875"
    }
  },
  "role": "Client",
  "activity": [
    "22.5.2025, 23:18:56"
  ],
  "registrAt": "22.5.2025, 23:18:56",
  "status": false,
  "createdAt": {
    "$date": "2025-05-22T23:18:56.703Z"
  },
  "updatedAt": {
    "$date": "2025-05-22T23:18:56.703Z"
  },
  "__v": 0
},
{
  "_id": {
    "$oid": "6831e346e9c223a65a56add9"
  },
  "googleId": "100716026113711515658",
  "name": {
    "first": "תאופיק",
    "last": "מחאמיד",
    "_id": {
      "$oid": "6831e346e9c223a65a56adda"
    }
  },
  "phone": {
    "phone_1": "0538346915",
    "phone_2": "",
    "_id": {
      "$oid": "6831e346e9c223a65a56addb"
    }
  },
  "address": {
    "city": "אום אל-פחם ",
    "street": "דרך עין אל דרווה ",
    "houseNumber": "24א",
    "_id": {
      "$oid": "6831e346e9c223a65a56addc"
    }
  },
  "email": "twpyqmhmyd@gmail.com",
  "password": "$2b$10$7UEZj1/oX3B41Mj5UVtEmOzvmbTU7cHVMNOam8Vxoqxqb7QcL5RDq",
  "image": {
    "url": "https://lh3.googleusercontent.com/a/ACg8ocLHRG2NpvRCiV7lj3p2ylU8cw6x1pxXKubhA2kCMT0c7yrs=s96-c",
    "alt": "תאופיק מחאמיד",
    "_id": {
      "$oid": "6831e346e9c223a65a56addd"
    }
  },
  "role": "Client",
  "activity": [
    "24.5.2025, 15:18:30"
  ],
  "registrAt": "24.5.2025, 15:18:30",
  "status": false,
  "createdAt": {
    "$date": "2025-05-24T15:18:30.042Z"
  },
  "updatedAt": {
    "$date": "2025-05-24T15:18:30.042Z"
  },
  "__v": 0
}]